{
  "version": "1.0",
  "job": {
    "job_id": "strict_powder_coat_cure_190c"
  },
  "spec": {
    "method": "PMT",
    "target_temp_C": 190.0,
    "hold_time_s": 900,
    "temp_band_C": {
      "min": 188.0,
      "max": 195.0
    },
    "sensor_uncertainty_C": 1.0
  },
  "data_requirements": {
    "max_sample_period_s": 15.0,
    "allowed_gaps_s": 30.0
  },
  "sensor_selection": {
    "mode": "mean_of_set",
    "sensors": ["pmt_sensor_1", "pmt_sensor_2", "pmt_sensor_3"],
    "require_at_least": 2
  },
  "logic": {
    "continuous": true,
    "max_total_dips_s": 0
  },
  "preconditions": {
    "max_ramp_rate_C_per_min": 10.0,
    "max_time_to_threshold_s": 600
  },
  "reporting": {
    "units": "C",
    "language": "en",
    "timezone": "UTC"
  }
}