{
  "version": "1.0",
  "job": {
    "job_id": "powder_coat_cure_qualicoat_enhanced"
  },
  "spec": {
    "method": "PMT",
    "target_temp_C": 185.0,
    "hold_time_s": 900,
    "sensor_uncertainty_C": 1.5
  },
  "data_requirements": {
    "max_sample_period_s": 20.0,
    "allowed_gaps_s": 30.0
  },
  "sensor_selection": {
    "mode": "min_of_set",
    "sensors": ["pmt_sensor_1", "pmt_sensor_2", "pmt_sensor_3"],
    "require_at_least": 2
  },
  "logic": {
    "continuous": true,
    "max_total_dips_s": 0
  },
  "preconditions": {
    "max_ramp_rate_C_per_min": 12.0,
    "max_time_to_threshold_s": 720
  },
  "reporting": {
    "units": "C",
    "language": "en",
    "timezone": "UTC"
  }
}